{"schemaVersion":1,"id":"completion:ad8f1566be84015c0f04a57022d196dda4c8872d00123cd7598ebebde1122e74","runId":"ad8f1566be84015c0f04a57022d196dda4c8872d00123cd7598ebebde1122e74","kind":"stage-result","scope":"delivery","status":"passed","producer":"Lighthouse GitHub Actions completion adapter","subject":{"type":"issue","id":"https://github.com/juangcarmona/lighthouse/issues/196"},"observedAt":"2026-11-01T09:11:12.764Z","artifacts":[{"type":"report","path":"report.md","sha256":"6801ce3a885f567fdc17ff7d66deb68a034537ce7fb52150f5ce355254b90365"},{"type":"report","path":"retrospective.md","sha256":"d49fa108eef5e6638b6d27aeda0c10a27b8627e4ecbdedb42e3164f256df64b0"},{"type":"receipt","path":"receipt.json","sha256":"9566d8ea9e186245a97bc003c69b78b53f9e6f0a8f87b6066b2eba94cc4387f7"},{"type":"receipt","path":"stage-result.json","sha256":"dbceb14dd95084708b39798f8e911510d2b77c8ac71fe07452f083ff95c154aa"}],"payload":{"stage":"integrate","priorIntegration":null,"binding":{"repository":"juangcarmona/lighthouse","issue":196,"pr":238,"head":"85cd5b37af4e0645d41b19026d83f77f88711232","base":"37da052a84691adc2a31d47373b587a0d0e3a949","branch":"main","intent":"6fe6b5d736e8bdd5ca6597144a6a6ceb47540ed8a02b73294b516763942414a8","policy":"5523fdaf39f43561115fb147c175dc75226e449619345d1456cc353f3233c207","reviews":"4f53cda18c2baa0c0354bb5f9a3ecbe5ed12ab4d8e11ba873c2f11161202b945","prIntent":"5ebf910dc16ec81a163db29c76260fdc968d6c03e3670c70b9fcf0d91ca780cc","files":"84f52b775e86d6b45060b427c27194f7bb785a6b40cb3d21723945251a548e90"},"requiredChecks":[{"context":"repository","app":15368,"revision":"85cd5b37af4e0645d41b19026d83f77f88711232","status":"passed","state":"passed","checks":[{"id":124804542067,"url":"https://github.com/juangcarmona/lighthouse/actions/runs/41291784260/job/124804542067","status":"completed","conclusion":"success","app":15368},{"id":124804362499,"url":"https://github.com/juangcarmona/lighthouse/actions/runs/41291787461/job/124804362499","status":"completed","conclusion":"success","app":15368}],"commitStatus":null}],"observedChecks":[{"evidenceId":"github-check:124804842086","name":"Exercise a clean consumer","revision":"85cd5b37af4e0645d41b19026d83f77f88711232","app":15368,"status":"unavailable","state":"pending","url":"https://github.com/juangcarmona/lighthouse/actions/runs/41291784267/job/124804842086"},{"evidenceId":"github-check:124804830440","name":"reconcile-implementation-pr","revision":"85cd5b37af4e0645d41b19026d83f77f88711232","app":15368,"status":"passed","state":"skipped","url":"https://github.com/juangcarmona/lighthouse/actions/runs/41291784260/job/124804830440"},{"evidenceId":"github-check:124804595050","name":"reconcile-implementation-pr","revision":"85cd5b37af4e0645d41b19026d83f77f88711232","app":15368,"status":"passed","state":"success","url":"https://github.com/juangcarmona/lighthouse/actions/runs/41291787461/job/124804595050"},{"evidenceId":"github-check:124804545591","name":"Install CLI in adopter checkout","revision":"85cd5b37af4e0645d41b19026d83f77f88711232","app":15368,"status":"passed","state":"skipped","url":"https://github.com/juangcarmona/lighthouse/actions/runs/41291784267/job/124804545591"},{"evidenceId":"github-check:124804544865","name":"Check package contents","revision":"85cd5b37af4e0645d41b19026d83f77f88711232","app":15368,"status":"passed","state":"success","url":"https://github.com/juangcarmona/lighthouse/actions/runs/41291784267/job/124804544865"},{"evidenceId":"github-check:124804542067","name":"repository","revision":"85cd5b37af4e0645d41b19026d83f77f88711232","app":15368,"status":"passed","state":"success","url":"https://github.com/juangcarmona/lighthouse/actions/runs/41291784260/job/124804542067"},{"evidenceId":"github-check:124804362499","name":"repository","revision":"85cd5b37af4e0645d41b19026d83f77f88711232","app":15368,"status":"passed","state":"success","url":"https://github.com/juangcarmona/lighthouse/actions/runs/41291787461/job/124804362499"}],"finalization":{"executor":"trusted publisher after current-stage validation","observedIssue":{"state":"open","labels":["pr-draft"]},"observedPullRequest":{"state":"open","merged":false,"labels":[]},"onPassed":{"add":["waiting-review"],"remove":[],"closeIssue":false},"onBlocked":{"add":["waiting-review"],"remove":[],"closeIssue":false},"pullRequestLabels":"preserve","reservation":"agent-working is added after this observation and released by host cleanup for every outcome"},"receipt":{"state":"merged","sha":"064832a9c919fe72dd8f1407e629d2565a5254cd","recovered":false,"acceptedHead":"85cd5b37af4e0645d41b19026d83f77f88711232","authorization":{"issue":196,"pr":238,"head":"85cd5b37af4e0645d41b19026d83f77f88711232","merge":true,"unattended":{"route":"ff","owner":"juangcarmona","policyDigest":"29389857aa68b2b90bf7957b23922723429997776b470cc0843b30f4b91ded88","review":{"binding":"b13c88c79ce0f1bfd95beca65d836c0fc17e26a9a6ff6d1d42a7d722c9c82fad","result":{"schemaVersion":1,"runId":"a8be471d5a784d1c5d8904c3ff1ea9d02fcb6f339cdda70fde6a52bdffd14c8c","stage":"integrate","status":"passed","gate":"done","evidence":[{"id":"candidate-scope-and-diff","status":"passed","source":"context.review.details changes and originalFiles; /workspace/src/tests/fixtures/unattended/README.md and authorized planning root","reason":"The README contains the requested controlled acceptance fixture phrase; the only implementation file is the README with the specified word correction, and all four planning artifacts are within the authorized planning root."},{"id":"npm-ci","status":"passed","source":"Executed host check receipt for npm ci --ignore-scripts","reason":"Exit code 0."},{"id":"repository-verify","status":"passed","source":"Executed host check receipt for env GITHUB_ACTIONS=true PUPPETEER_EXECUTABLE_PATH=/usr/bin/chromium npm run verify","reason":"Exit code 0; verify completed with 301 passing, 0 failing and 6 skipped tests, and the remaining verification steps succeeded."},{"id":"fixture-regression","status":"passed","source":"Executed host check receipt for node --test src/tests/fixtures/unattended/regression.test.mjs","reason":"Exit code 0; all three tests passed."},{"id":"openspec-validation","status":"passed","source":"Executed host check receipt for strict OpenSpec validation of issue-196-proposal","reason":"Exit code 0; the provider reported the change valid with skip_specs enabled and zero spec deltas accepted."}],"missingEvidence":[],"unavailableChecks":[],"pendingReview":[],"nextAction":"Return the accepted candidate assessment to the trusted host for its subsequent publication and host-owned gates; this review does not authorize merge or release.","output":{"review":{"binding":"b13c88c79ce0f1bfd95beca65d836c0fc17e26a9a6ff6d1d42a7d722c9c82fad","verdict":"accept","findings":[]}}},"model":{"requested":{"profile":"fast","model":"openai/gpt-6-luna","reasoningEffort":"high"},"resolved":{"mode":"profile","profile":"fast","model":"openai/gpt-6-luna","reasoningEffort":"high","engineModel":"openai/gpt-6-luna#high","source":"task.profile","fields":{"model":"project","reasoningEffort":"project"},"capabilityEvidence":"operator-configuration-only"},"providerReported":{"model":null,"reasoningEffort":null,"status":"unverified","reason":"The current adapter has no authenticated provider-settings receipt"},"billing":{"route":"unchanged","actualCost":null,"estimatedApiEquivalentCost":null,"subscriptionUsage":null}},"execution":{"status":"passed","exitCode":0,"signal":null,"resources":{"pidsLimit":128,"pidsPeak":29,"pidsDenied":0,"memoryPeakBytes":356614144,"oomKills":0}}}}},"postMerge":[]},"checkSource":"GitHub REST API","workflow":{"runId":"41290697468","attempt":"1","url":"https://github.com/juangcarmona/lighthouse/actions/runs/41290697468","harnessRevision":"95db8fba838ef40777cf718c4f63136e5d2c764b"}},"nextAction":"Return to the trusted host"}